A1: Value | B1: Attenuation (dB) | C1: Gain (dB) | D1: Gain (e-/DN) | E1: ¡@ | F1: Amplification (V/V)
A2: 0 | B2: 0 | C2: +24 | D2: 0.4 | E2: ¡@ | F2: 16.5
A3: 1 | B3: 10 | C3: +13 | D3: 1.4 | E3: x3.50 | F3: 4.50
A4: 2 | B4: 20 | C4: +3.5 | D4: 4.0 | E4: x2.86 | F4: 1.50
A5: 3 | B5: 30 | C5: -7.7 | D5: 14 | E5: x3.50 | F5: 0.41

A1: Value | B1: Nominal Gain (dB) | C1: Actual Gain | D1: ¡@ | E1: Nominal Responsivity (e-/DN) | F1: Actual Dynamic Range(e-) | G1: Nominal Dynamic Range(e-)
A2: 0 | B2: 30 | C2: 00.41 | E2: 0.5 | F2: 8192 | G2: 8000
A3: 1 | B3: 10 | C3: 1.50 | D3: x3.66 | E3: 1.8 | F3: 29825 | G3: 30000
A4: 2 | B4: 3 | C4: 4.53 | D4: x3.20 | E4: 5.5 | F4: 90112 | G4: 90000
A5: 3 | B5: 1 | C5: 16.50 | D5: x3.64 | E5: 20 | F5: 328000 | G5: 330000

A1: Value | B1: Corner Frequency | C1: Time Constant (nSec)
A2: 0 | B2: 15900 kHz | C2: 10.0
A3: 1 | B3: 5640 kHz | C3: 28.2
A4: 2 | B4: 194 kHz | C4: 820.0
A5: 3 | B5: 69 kHz | C5: 2310.0

A1: Time Constant (ns) | B1: Nominal Pixel Rate (kHz) | C1: Nominal Full Frame Rate (Hz)
A2: 200 | B2: 2500 | C2: 1000
A3: 500 | B3: 1500 | C3: 625
A4: 900 | B4: 250 | C4: 125
A5: 1200 | B5: 80 | C5: 40

A1: Program | B1: Nominal Frame Rate (Hz) | C1: Image size | D1: Binning
A2: 0 | B2: 1000 | C2: 80 x 80 | D2: 1 x 1
A3: 1 | B3: 625 | C3: 80 x 80 | D3: 1 x 1
A4: 2 | B4: 125 | C4: 80 x 80 | D4: 1 x 1
A5: 3 | B5: 40 | C5: 80 x 80 | D5: 1 x 1
A6: 4 | B6: 2000 | C6: 40 x 40 | D6: 2 x 2
A7: 5 | B7: 3000 | C7: 40 x 40 | D7: 2 x 2
A8: 6 | B8: 5000 | C8: 26 x 26 | D8: 3 x 3
A9: 7 | B9: 2000 | C9: 80 x 80 | D9: 1 x 1

A1: Sequence | B1: Format | C1: Binning Mode | D1: Nominal Frame Rate | E1: Actual Frame Rate | F1: Nominal Frame Time (ms) | G1: Actual Frame Time (ms) | H1: Vertical Shift Time | I1: Integration increment (us) | J1: Maximum period(s) | K1: Read Noise at 30 dB
A2: 0 | B2: 80x80 | C2: 1x1 | D2: 1000 | E2: 1001 | F2: =1000/D2 -> 1.000 | G2: =1000/E2 -> 0.99900099900099903 | H2: 40 us | I2: 50 | J2: =G2+16.383*I2 -> 820.14900099900103 | K2: 8.5
A3: 1 | B3: 80x80 | C3: 1x1 | D3: 626 | E3: 626 | F3: =1000/D3 -> 1.5974440894568691 | G3: =1000/E3 -> 1.5974440894568691 | H3: 40 us | I3: 100 | J3: =G3+16.383*I3 -> 1639.8974440894567 | K3: 7.5
A4: 2 | B4: 80x80 | C4: 1x1 | D4: 125 | E4: 125 | F4: =1000/D4 -> 8.000 | G4: =1000/E4 -> 8.000 | H4: 40 us | I4: 100 | J4: =G4+16.383*I4 -> 1646.3 | K4: 5.1
A5: 3 | B5: 80x80 | C5: 1x1 | D5: 40 | E5: 40 | F5: =1000/D5 -> 25.000 | G5: =1000/E5 -> 25.000 | H5: 40 us | I5: 500 | J5: =G5+16.383*I5 -> 8216.5 | K5: 3.3
A6: 4 | B6: 40x40 | C6: 2x2 | D6: 2000 | E6: 2020 | F6: =1000/D6 -> 0.500 | G6: =1000/E6 -> 0.49504950495049505 | H6: 40 us | I6: 4 | J6: =G6+16.383*I6 -> 66.027049504950497 | K6: 11.4
A7: 5 | B7: 40x40 | C7: 2x2 | D7: 3000 | E7: 3079 | F7: =1000/D7 -> 0.33333333333333331 | G7: =1000/E7 -> 0.32478077297823971 | H7: 7.2 us | I7: 00.1 | J7: =G7+16.383*I7 -> 1.9630807729782398 | K7: 11.5
A8: 6 | B8: 26x26 | C8: 3x3 | D8: 5000 | E8: 5051 | F8: =1000/D8 -> 00.2 | G8: =1000/E8 -> 0.19798059790140565 | H8: 7.2 us | I8: 00.1 | J8: =G8+16.383*I8 -> 1.8362805979014056 | K8: 13
A9: 7 | B9: 80x80 | C9: 1x1 | D9: 2000 | E9: 2024 | F9: =1000/D9 -> 0.500 | G9: =1000/E9 -> 0.49407114624505927 | H9: 7.2 us | I9: 00.1 | J9: =G9+16.383*I9 -> 2.1323711462450592 | K9: 19